{
  "face": {
    "outputs": [
      {
        "captured_image_analyzer": {
          "error": null,
          "version": "test-face"
        },
        "challenge_response": null,
        "role": "Face",
        "source": "Orb",
        "template_generator": {
          "extra_diagnostic": {
            "value": 0.1234567890123456789012
          },
          "version": "test-face"
        }
      }
    ],
    "request_type": {
      "source": "Orb",
      "type": "embedding"
    }
  },
  "iris": {
    "left": {
      "outputs": {
        "capture_qa": {
          "metadata": {
            "irnet_version": "3.5.0"
          }
        },
        "pad": null,
        "pipeline": {
          "error": null
        }
      },
      "role": "LeftIris",
      "side": "Left"
    },
    "pair": {
      "output": {
        "embedding": {},
        "error": null,
        "gabor": {}
      },
      "role": "IrisPair"
    },
    "right": {
      "outputs": {
        "capture_qa": {
          "metadata": {
            "irnet_version": "3.5.0"
          }
        },
        "pad": null,
        "pipeline": {
          "error": null
        }
      },
      "role": "RightIris",
      "side": "Right"
    }
  },
  "metadata": {
    "end_timestamp": 123.75,
    "environment": {
      "boot_id": "0000000000000000000000000000000000000000000000000000000000000000",
      "tee": {
        "attestation": {
          "measurements_zeroed": false,
          "pcrs": {
            "0": "111111111111111111111111111111111111111111111111111111111111111111111111111111111111111111111111",
            "1": "111111111111111111111111111111111111111111111111111111111111111111111111111111111111111111111111",
            "2": "111111111111111111111111111111111111111111111111111111111111111111111111111111111111111111111111"
          }
        },
        "technology": "aws_nitro_enclaves"
      },
      "type": "tee"
    },
    "hardware": {
      "architecture": "x86_64",
      "usable_logical_cpus": 2,
      "visible_memory_bytes": 12884901888
    },
    "signup_reason": "Normal",
    "signup_status": "Success",
    "software_version": {
      "face_engine_version": "test-face",
      "iris_engine_version": "3.5.0",
      "main_program_version": "0.1.0",
      "worker_sha384": "abababababababababababababababababababababababababababababababababababababababababababababababab",
      "worker_version": "test-worker"
    },
    "source_pcp_version": "2.7",
    "start_timestamp": 123.5
  },
  "pipeline_errors": {
    "migration_error": null
  },
  "signup_id": {
    "data_id": 0,
    "s3_region": 0,
    "signup_id": [
      0,
      0,
      0,
      0,
      0,
      0,
      0,
      0,
      0,
      1
    ],
    "version": 0
  },
  "src_signup_id": {
    "data_id": 0,
    "s3_region": 0,
    "signup_id": [
      0,
      0,
      0,
      0,
      0,
      0,
      0,
      0,
      0,
      0
    ],
    "version": 0
  },
  "version": "1f4a335d007ddd5e803463b411c6d23b09adbec191c72790b969b6f495055364"
}
